<entity-mappings xmlns="http://mpa.io/orm/schema"
	xmlns:xsi="http://www.w3.org/2001/XMLSchema-instance"
	xsi:schemaLocation="http://mpa.io/orm/schema orm-schema.xsd ">
	<description></description>
	<entity class="entity.Basic" name="basic">
		<attributes>
			<id name="id" attribute-type="string">
				<field>mpa.types.DataTimeId</field>
			</id>
			<basic name="string" attribute-type="string" />
			<basic name="double" attribute-type="double" />
			<basic name="int" attribute-type="int" />
		</attributes>
	</entity>

	<entity class="entity.Collections" name="collections">
		<attributes>
			<id name="id" attribute-type="string">
				<field>mpa.types.DataTimeId</field>
			</id>
			<element-collection name="strings" attribute-type="string" />
			<element-collection name="doubles" attribute-type="double" />
			<element-collection name="ints" attribute-type="int" />
		</attributes>
	</entity>

	<entity class="entity.IntensityMeasurement" name="IntensityMeasurement">
		<data-manager class='TestDataManager' name='TestDataManager' />
		<attributes>
			<id name="id" attribute-type="string">
				<field>mpa.types.DataTimeId</field>
			</id>
			<basic name="calibrationDate" attribute-type="string" />
			<basic name="wavelength" attribute-type="double" />
			<basic name="wavelengthExponent" attribute-type="int" />
			<basic name="responsivity" attribute-type="double" />
			<basic name="diameterX" attribute-type="double" />
			<basic name="diameterY" attribute-type="double" />
			<basic name="diameterExponent" attribute-type="int" />
			<basic name="spotFocus" attribute-type="double" />
			<basic name="spotFocusExponent" attribute-type="int" />

			<element-collection name="voltages"
				attribute-type="double" />
			<element-collection name="voltageExponent"
				attribute-type="double" />
			<element-collection name="powers" attribute-type="double" />
			<element-collection name="powerExponent"
				attribute-type="double" />
		</attributes>
	</entity>
</entity-mappings>
